USE,FILE NAME,USETEST,MOVE,AVAILABLE,DURATION,CHANNEL,NOTES,SCALE,FEELING,ROOM / DEVICE,STAGE,MOTION,LIGHT,COLOR,O,P,Q,R,S,T,U,V,w
Y,Cleanroom_01.mov,,,UPLOADED,2:00:03,ALICE,Clean room cleaning bottle,human,caring,Diamond Acid,Prep,Still,Light,,,,,,Cine,MILD,,,
Y,Cleanroom_02.mov,,,UPLOADED,1:08:00,ALICE,boiling dimaond,human,caring,Diamond Acid,Prep,Still,Light,,,,,,Cine,MILD,,,
Y,Cleanroom_03.mov,,,UPLOADED,0:30:16,ALICE,Clean room puring acid shaky hand,human,caring,Diamond Acid,Prep,Still,,,,,,,Cine,MILD,,,
Y,Cleanroom_04.mov,,,UPLOADED,0:30:12,ALICE,Clean room close up puring acid shaky hand,human,caring,Diamond Acid,Prep,Still,,,,,,,Cine,MILD,,,
Y,Cleanroom_05.mov,,,UPLOADED,1:23:00,ALICE,clenn room placing diamond in acid,human,caring,Diamond Acid,Prep,Still,,,,,,,Cine,MILD,,,
Y,Cleanroom_06.mov,,,UPLOADED,0:15:00,ALICE,Clean room two small jars hands move them,human,caring,Diamond Acid,Prep,Still,,,,,,,Cine,MILD,,,
